{"embedding":{"dim":384,"model_id":"minilm-l6-v2","scale":10000,"stored":"per_news_item","trained_before_ms":1640995200000},"features":[{"asof_only":false,"description":"Close of the last completed bar, else first_price_bp.","hi":10000,"index":0,"lo":0,"name":"last_price_bp","scale":10000,"source":"market_view","unit":"bp"},{"asof_only":false,"description":"logit_milli of last_price_bp.","hi":50000,"index":1,"lo":-50000,"name":"logit_last_milli","scale":1000,"source":"market_view","unit":"milli"},{"asof_only":false,"description":"best_ask_bp minus best_bid_bp of the last completed bar, 0 when unknown.","hi":10000,"index":2,"lo":0,"name":"spread_bp","scale":10000,"source":"market_view","unit":"bp"},{"asof_only":false,"description":"Price change over the last completed bar.","hi":10000,"index":3,"lo":-10000,"name":"ret_1b_bp","scale":10000,"source":"bars","unit":"bp"},{"asof_only":false,"description":"Price change over the last seven completed bars.","hi":10000,"index":4,"lo":-10000,"name":"ret_7b_bp","scale":10000,"source":"bars","unit":"bp"},{"asof_only":false,"description":"Price change over the last thirty completed bars.","hi":10000,"index":5,"lo":-10000,"name":"ret_30b_bp","scale":10000,"source":"bars","unit":"bp"},{"asof_only":false,"description":"Price change over the last ninety completed bars.","hi":10000,"index":6,"lo":-10000,"name":"ret_90b_bp","scale":10000,"source":"bars","unit":"bp"},{"asof_only":false,"description":"Mean absolute bar return over the last thirty completed bars.","hi":10000,"index":7,"lo":0,"name":"realised_vol_bp_30b","scale":10000,"source":"bars","unit":"bp"},{"asof_only":false,"description":"Last price minus the highest close of the last thirty bars.","hi":10000,"index":8,"lo":0,"name":"dist_from_high_bp_30b","scale":10000,"source":"bars","unit":"bp"},{"asof_only":false,"description":"Last price minus the lowest close of the last thirty bars.","hi":10000,"index":9,"lo":0,"name":"dist_from_low_bp_30b","scale":10000,"source":"bars","unit":"bp"},{"asof_only":false,"description":"ln(1 + volume_milli) of the last completed bar, in milli-nats.","hi":30000,"index":10,"lo":0,"name":"volume_milli_1b_log_milli","scale":1000,"source":"bars","unit":"milli"},{"asof_only":false,"description":"Last bar volume as a z score over the last thirty bars.","hi":10000,"index":11,"lo":-10000,"name":"volume_milli_z_milli_30b","scale":1000,"source":"bars","unit":"milli"},{"asof_only":false,"description":"ln(1 + volume_milli_to_date), in milli-nats.","hi":30000,"index":12,"lo":0,"name":"volume_milli_to_date_log_milli","scale":1000,"source":"bars","unit":"milli"},{"asof_only":false,"description":"ln(1 + n_trades_to_date), in milli-nats.","hi":30000,"index":13,"lo":0,"name":"n_trades_to_date_log_milli","scale":1000,"source":"bars","unit":"milli"},{"asof_only":false,"description":"Bars from now_ms to close_at_ms; close_at_ms is public on every venue.","hi":100000,"index":14,"lo":0,"name":"bars_to_close","scale":1,"source":"calendar","unit":"count"},{"asof_only":false,"description":"ln(1 + close_at_ms - now_ms), in milli-nats.","hi":30000,"index":15,"lo":0,"name":"ms_to_close_log_milli","scale":1000,"source":"calendar","unit":"milli"},{"asof_only":false,"description":"Completed bars since the market was listed.","hi":100000,"index":16,"lo":0,"name":"bars_since_listed","scale":1,"source":"calendar","unit":"count"},{"asof_only":false,"description":"Day of week of now_ms, Monday is 0.","hi":6,"index":17,"lo":0,"name":"day_of_week","scale":1,"source":"calendar","unit":"index"},{"asof_only":false,"description":"Hour of day of now_ms in UTC.","hi":23,"index":18,"lo":0,"name":"hour_of_day","scale":1,"source":"calendar","unit":"index"},{"asof_only":false,"description":"Index into the provider list of CONTRACTS_V2 section 2.","hi":4,"index":19,"lo":0,"name":"provider_index","scale":1,"source":"category","unit":"index"},{"asof_only":false,"description":"Index into pmx.types.CATEGORIES.","hi":11,"index":20,"lo":0,"name":"category_index","scale":1,"source":"category","unit":"index"},{"asof_only":false,"description":"News items visible at now_ms linked to this market in the last day.","hi":1000,"index":21,"lo":0,"name":"news_count_1d","scale":1,"source":"news","unit":"count"},{"asof_only":false,"description":"News items visible at now_ms linked to this market in the last seven days.","hi":1000,"index":22,"lo":0,"name":"news_count_7d","scale":1,"source":"news","unit":"count"},{"asof_only":false,"description":"Lexicon direction score over the seven-day window.","hi":1000,"index":23,"lo":-1000,"name":"news_direction_milli_7d","scale":1000,"source":"news","unit":"milli"},{"asof_only":false,"description":"Lexicon intensity score over the seven-day window.","hi":1000,"index":24,"lo":0,"name":"news_intensity_milli_7d","scale":1000,"source":"news","unit":"milli"},{"asof_only":false,"description":"Novelty of the window against the previous seven days.","hi":1000,"index":25,"lo":0,"name":"news_novelty_milli_7d","scale":1000,"source":"news","unit":"milli"},{"asof_only":false,"description":"Best link score among the visible items.","hi":1000,"index":26,"lo":0,"name":"news_match_score_permille_max","scale":1000,"source":"news","unit":"permille"},{"asof_only":true,"description":"This market's last price minus its as-of cluster peers' mean last price.","hi":10000,"index":27,"lo":-10000,"name":"cluster_gap_bp","scale":10000,"source":"cluster","unit":"bp"},{"asof_only":true,"description":"Members of this market's as-of cluster other than itself.","hi":64,"index":28,"lo":0,"name":"cluster_peer_count","scale":1,"source":"cluster","unit":"count"},{"asof_only":true,"description":"Residual of the as-of constraint this market sits in, 0 when none.","hi":1000000,"index":29,"lo":-1000000,"name":"constraint_residual_ppm","scale":1000000,"source":"constraint","unit":"ppm"},{"asof_only":true,"description":"As-of constraints this market sits in.","hi":64,"index":30,"lo":0,"name":"constraint_count","scale":1,"source":"constraint","unit":"count"},{"asof_only":false,"description":"The agent's signed position in contracts.","hi":1000000,"index":31,"lo":-1000000,"name":"position","scale":1,"source":"portfolio","unit":"count"},{"asof_only":false,"description":"Volume-weighted entry price of the open leg, 0 when flat.","hi":10000,"index":32,"lo":0,"name":"avg_cost_bp","scale":10000,"source":"portfolio","unit":"bp"},{"asof_only":false,"description":"Position marked to last_price_bp.","hi":100000000,"index":33,"lo":-100000000,"name":"unrealised_cents","scale":100,"source":"portfolio","unit":"cents"},{"asof_only":false,"description":"Cash plus positions value at the last mark.","hi":100000000,"index":34,"lo":0,"name":"equity_cents","scale":100,"source":"portfolio","unit":"cents"},{"asof_only":false,"description":"Equity against peak equity.","hi":0,"index":35,"lo":-10000,"name":"drawdown_bp","scale":10000,"source":"portfolio","unit":"bp"},{"asof_only":false,"description":"Resting orders the agent holds.","hi":1000,"index":36,"lo":0,"name":"n_open_orders","scale":1,"source":"portfolio","unit":"count"}],"features_hash":"7077333ea0c18a0ad004a763dcd6574165e2d95b4d389f9e98b77de0a3d834be","features_version":"features.v1","float_view":{"clamp":true,"divide_by_scale":true,"dtype":"float32"},"n_features":37,"quantise":{"clamp_hi_ppm":1000000,"clamp_lo_ppm":0,"position_unit":1,"prob_scale":1000000,"rounding":"half_up"},"schema_version":"features.v1"}
